278	TRUMP	The office is called VOICE — Victims of Immigration Crime Engagement.	0
279	TRUMP	We are providing a voice to those who have been ignored by our media and silenced by special interests.	0
280	SYSTEM	(APPLAUSE)	0
281	TRUMP	Joining us in the audience tonight are four very brave Americans whose government failed them.	0
282	TRUMP	Their names are Jamiel Shaw, Susan Oliver, Jenna Oliver, and Jessica Davis.	0
283	TRUMP	Jamiel’s 17-year-old son was viciously murdered by an illegal immigrant gang member who had just been released from prison.	0
284	TRUMP	Jamiel Shaw, Jr. was an incredible young man, with unlimited potential who was getting ready to go to college where he would have excelled as a great college quarterback.	0
285	TRUMP	But he never got the chance.	0
286	TRUMP	His father, who is in the audience tonight, has become a very good friend of mine.	0
287	TRUMP	Jamiel, thank you.	0
288	TRUMP	Thank you.	0
289	SYSTEM	(APPLAUSE)	0
290	TRUMP	Also with us are Susan Oliver and Jessica Davis.	0
291	TRUMP	Their husbands, Deputy Sheriff Danny Oliver and Detective Michael Davis, were slain in the line of duty in California.	0
292	TRUMP	They were pillars of their community.	0
293	TRUMP	These brave men were viciously gunned down by an illegal immigrant with a criminal record and two prior deportations.	0
294	TRUMP	Should have never been in our country.	0
295	TRUMP	Sitting with Susan is her daughter, Jenna.	0
296	TRUMP	Jenna, I want you to know that your father was a hero, and that tonight you have the love of an entire country supporting you and praying for you.	0
297	SYSTEM	(APPLAUSE)	0
298	TRUMP	To Jamiel, Jenna, Susan and Jessica, I want you to know that we will never stop fighting for justice.	0
299	TRUMP	Your loved ones will never, ever be forgotten.	0
300	TRUMP	We will always honor their memory.	0
301	SYSTEM	(APPLAUSE)	0
302	TRUMP	Finally, to keep America safe, we must provide the men and women of the United States military with the tools they need to prevent war — if they must — they have to fight and they only have to win.	0
303	SYSTEM	(APPLAUSE)	0
304	TRUMP	I am sending Congress a budget that rebuilds the military, eliminates the defense sequester — 	0
305	SYSTEM	(APPLAUSE)	0
306	TRUMP	— and calls for one of the largest increases in national defense spending in American history.	1
307	TRUMP	My budget will also increase funding for our veterans.	0
308	TRUMP	Our veterans have delivered for this nation, and now we must deliver for them.	0
309	SYSTEM	(APPLAUSE)	0
310	TRUMP	The challenges we face as a nation are great, but our people are even greater.	0
311	TRUMP	And none are greater or braver than those who fight for America in uniform.	0
312	SYSTEM	(APPLAUSE)	0
313	TRUMP	We are blessed to be joined tonight by Carryn Owens, the widow of a U.S. Navy Special Operator, Senior Chief William “Ryan” Owens.	0
314	TRUMP	Ryan died as he lived:  a warrior and a hero, battling against terrorism and securing our nation.	0
315	SYSTEM	(APPLAUSE)	0
316	TRUMP	I just spoke to our great General Mattis, just now, who reconfirmed that — and I quote — “Ryan was a part of a highly successful raid that generated large amounts of vital intelligence that will lead to many more victories in the future against our enemies.”	0
317	TRUMP	Ryan’s legacy is etched into eternity.	0
318	TRUMP	Thank you.	0
319	SYSTEM	(APPLAUSE)	0
320	TRUMP	And Ryan is looking down, right now — you know that — and he is very happy because I think he just broke a record.	0
321	SYSTEM	(LAUGHTER)	0
322	SYSTEM	(APPLAUSE)	0
323	TRUMP	For as the Bible teaches us, “There is no greater act of love than to lay down one’s life for one’s friends.”	0
324	TRUMP	Ryan laid down his life for his friends, for his country, and for our freedom.	0
325	TRUMP	And we will never forget Ryan.	0
326	SYSTEM	(APPLAUSE)	0
327	TRUMP	To those allies who wonder what kind of a friend America will be, look no further than the heroes who wear our uniform.	0
328	TRUMP	Our foreign policy calls for a direct, robust and meaningful engagement with the world.	0
329	TRUMP	It is American leadership based on vital security interests that we share with our allies all across the globe.	0
330	TRUMP	We strongly support NATO, an alliance forged through the bonds of two world wars that dethroned fascism, and a Cold War, and defeated communism.	0
331	SYSTEM	(APPLAUSE)	0
332	TRUMP	But our partners must meet their financial obligations.	0
333	TRUMP	And now, based on our very strong and frank discussions, they are beginning to do just that.	0
334	TRUMP	In fact, I can tell you, the money is pouring in.	0
335	TRUMP	Very nice.	0
336	SYSTEM	(APPLAUSE)	0
337	TRUMP	We expect our partners — whether in NATO, the Middle East, or in the Pacific — to take a direct and meaningful role in both strategic and military operations, and pay their fair share of the cost.	0
338	TRUMP	Have to do that.	0
339	TRUMP	We will respect historic institutions, but we will respect the foreign rights of all nations, and they have to respect our rights as a nation also.	0
340	SYSTEM	(APPLAUSE)	0
341	TRUMP	Free nations are the best vehicle for expressing the will of the people, and America respects the right of all nations to chart their own path.	0
342	TRUMP	My job is not to represent the world.	0
343	TRUMP	My job is to represent the United States of America.	0
344	SYSTEM	(APPLAUSE)	0
345	TRUMP	But we know that America is better off when there is less conflict, not more.	0
346	TRUMP	We must learn from the mistakes of the past.	0
347	TRUMP	We have seen the war and the destruction that have ravaged and raged throughout the world — all across the world.	0
348	TRUMP	The only long-term solution for these humanitarian disasters, in many cases, is to create the conditions where displaced persons can safely return home and begin the long, long process of rebuilding.	0
349	SYSTEM	(APPLAUSE)	0
350	TRUMP	America is willing to find new friends, and to forge new partnerships, where shared interests align.	0
351	TRUMP	We want harmony and stability, not war and conflict.	0
352	TRUMP	We want peace, wherever peace can be found.	0
353	TRUMP	America is friends today with former enemies.	0
354	TRUMP	Some of our closest allies, decades ago, fought on the opposite side of these terrible, terrible wars.	0
355	TRUMP	This history should give us all faith in the possibilities for a better world.	0
356	TRUMP	Hopefully, the 250th year for America will see a world that is more peaceful, more just, and more free.	0
357	TRUMP	On our 100th anniversary, in 1876, citizens from across our nation came to Philadelphia to celebrate America’s centennial.	0
358	TRUMP	At that celebration, the country’s builders and artists and inventors showed off their wonderful creations.	0
359	TRUMP	Alexander Graham Bell displayed his telephone for the first time.	0
360	TRUMP	Remington unveiled the first typewriter.	0
361	TRUMP	An early attempt was made at electric light.	0
362	TRUMP	Thomas Edison showed an automatic telegraph and an electric pen.	0
363	TRUMP	Imagine the wonders our country could know in America’s 250th year.	0
364	SYSTEM	(APPLAUSE)	0
365	TRUMP	Think of the marvels we can achieve if we simply set free the dreams of our people.	0
366	TRUMP	Cures to the illnesses that have always plagued us are not too much to hope.	0
367	TRUMP	American footprints on distant worlds are not too big a dream.	0
368	TRUMP	Millions lifted from welfare to work is not too much to expect.	1
369	TRUMP	And streets where mothers are safe from fear, schools where children learn in peace, and jobs where Americans prosper and grow are not too much to ask.	0
370	SYSTEM	(APPLAUSE)	0
371	TRUMP	When we have all of this, we will have made America greater than ever before — for all Americans.	0
372	TRUMP	This is our vision.	0
373	TRUMP	This is our mission.	0
374	TRUMP	But we can only get there together.	0
375	TRUMP	We are one people, with one destiny.	0
376	TRUMP	We all bleed the same blood.	0
377	TRUMP	We all salute the same great American flag.	0
378	TRUMP	And we all are made by the same God.	0
379	SYSTEM	(APPLAUSE)	0
380	TRUMP	When we fulfill this vision, when we celebrate our 250 years of glorious freedom, we will look back on tonight as when this new chapter of American Greatness began.	0
381	TRUMP	The time for small thinking is over.	0
382	TRUMP	The time for trivial fights is behind us.	0
383	TRUMP	We just need the courage to share the dreams that fill our hearts, the bravery to express the hopes that stir our souls, and the confidence to turn those hopes and those dreams into action.	0
384	TRUMP	From now on, America will be empowered by our aspirations, not burdened by our fears; inspired by the future, not bound by the failures of the past; and guided by our vision, not blinded by our doubts.	0
385	TRUMP	I am asking all citizens to embrace this renewal of the American spirit.	0
386	TRUMP	I am asking all members of Congress to join me in dreaming big, and bold, and daring things for our country.	0
387	TRUMP	I am asking everyone watching tonight to seize this moment.	0
388	TRUMP	Believe in yourselves, believe in your future, and believe, once more, in America.	0
389	TRUMP	Thank you, God bless you, and God bless the United States.	0
390	SYSTEM	(APPLAUSE)	0
