1	TRUMP	Thank you very much, everybody.	0
2	TRUMP	Before we begin, I’d like to just say that we have a large team of very talented people in China.	0
3	TRUMP	We’ve had a negotiation going on for about two days.	0
4	TRUMP	It’s going extremely well.	0
5	TRUMP	Who knows what that means, because it only matters if we get it done.	0
6	TRUMP	But we’re very much working very closely with China and President Xi, who I respect a lot.	0
7	TRUMP	Very good relationship that we have.	0
8	TRUMP	And we’re a lot closer than we ever were in this country with having a real trade deal.	0
9	TRUMP	We’re covering everything — all of the points that people have been talking about for years that said couldn’t be done, whether it was theft or anything.	0
10	TRUMP	Anything.	0
11	TRUMP	The unfairness.	0
12	TRUMP	We’ve been losing, on average, $375 billion a year with China.	1
13	TRUMP	A lot of people think it’s $506 billion.	0
14	TRUMP	Some people think it’s much more than that.	0
15	TRUMP	We’re going to be leveling the playing field.	0
16	TRUMP	The tariffs are hurting China very badly.	0
17	TRUMP	They don’t want them.	0
18	TRUMP	And frankly, if we can make the deal, it’d be my honor to remove them.	0
19	TRUMP	But otherwise, we’re having many billions of dollars pouring into our Treasury.	0
20	TRUMP	We’ve never had that before with China.	0
21	TRUMP	It’s been very much of a one-way street.	0
22	TRUMP	So, that’s happening.	0
23	TRUMP	And the relationship with China is very good, but I think they finally respect our country.	0
24	TRUMP	They haven’t respected us for a long time.	0
25	TRUMP	Not for a long time.	0
26	TRUMP	The UK and the U.S., as you probably have been seeing and hearing, we’re agreeing to go forward and preserve our trade agreement.	0
27	TRUMP	You know all of the situation with respect to Brexit, and the complexity and the problems.	0
28	TRUMP	But we have a very good trading relationship with the UK, and that’s just been strengthened further.	0
29	TRUMP	So with the UK, we’re continuing our trade, and we are going to actually be increasing it very substantially as time goes by.	0
30	TRUMP	We expect that the UK will be very, very substantially increased as it relates to trade with the United States.	0
31	TRUMP	The relationship there, also, is very good.	0
32	TRUMP	We have a lot of great announcements having to do with Syria and our success with the eradication of the caliphate.	0
33	TRUMP	And that will be announced over the next 24 hours.	0
34	TRUMP	And many other things.	0
35	TRUMP	A lot of positive things are going on.	0
36	TRUMP	We’re working on a summit.	0
37	TRUMP	And you know all about the summit.	0
38	TRUMP	It will be in Vietnam — Hanoi.	0
39	TRUMP	And we will — we’ll be meeting in Hanoi.	0
40	TRUMP	We’ll be meeting in Hanoi.	0
41	TRUMP	I think a lot of you will be going, I suspect.	0
42	TRUMP	And I hope we have the same good luck as we had in the first summit.	0
43	TRUMP	A lot was done in the first summit.	0
44	TRUMP	No more rockets going up.	0
45	TRUMP	No more missiles going up.	0
46	TRUMP	No more testing of nuclear.	0
47	TRUMP	Get back our remains, the remains of our great heroes from the Korean War.	0
48	TRUMP	And we got back our hostages.	0
49	TRUMP	But we hope we’re going to be very much equally as successful.	0
50	TRUMP	I’m in no rush for speed.	0
51	TRUMP	We just don’t want testing.	0
52	TRUMP	The sanctions, as you know, remain.	0
53	TRUMP	Everything is remaining.	0
54	TRUMP	China has been helping us, and Russia has been helping us.	0
55	TRUMP	And South Korea, I think you can say, has been — we’ve been working very closely with South Korea, with Japan.	0
56	TRUMP	But China, Russia, on the border, have really been at least partially living up to what they’re supposed to be doing.	0
57	TRUMP	And that’s okay — as per the United Nations.	0
58	TRUMP	So we will have a meeting on the 27th and 28th of February, and I think that will be a very successful one.	0
59	TRUMP	I look forward to seeing Chairman Kim.	0
60	TRUMP	We have also established a very good relationship, which has never happened between him or his family and the United States.	0
61	TRUMP	They have really taken advantage of the United States.	0
62	TRUMP	Billions of dollars has been paid to them.	0
63	TRUMP	And we won’t let that happen.	0
64	TRUMP	But we think that North Korea and Chairman Kim have a tremendous potential as an economic force, economic power.	0
65	TRUMP	Their location between South Korea and then Russia and China — right smack in the middle — is phenomenal.	0
66	TRUMP	And we think that they have a great chance for tremendous economic prosperity in the future.	0
67	TRUMP	So I look forward to seeing Chairman Kim in Vietnam.	0
68	TRUMP	Today, I’m announcing several critical actions that my administration has taken to confront a problem that we have right here at home.	0
69	TRUMP	"We fight wars that are 6,000 miles away; wars that we should have never been in, in many cases."	0
70	TRUMP	But we don’t control our own border.	0
71	TRUMP	So we’re going to confront the national security crisis on our southern border.	0
72	TRUMP	And we’re going to do it one way or the other — we have to do it — not because it was a campaign promise, which it is.	0
73	TRUMP	"It was one of many, by the way; not my only one."	0
74	TRUMP	We’re rebuilding the military, our economy is thriving like never before.	0
75	TRUMP	You look at other economies — they’re doing terribly, and we’re doing phenomenally.	0
76	TRUMP	"The market is up tremendously today, not that that’s anything, but, you know — because I’ll go back in and they’ll say, ""Oh, the market just went down."""	0
77	TRUMP	But the market is getting close to the new highs that we created.	0
78	TRUMP	We have all the records.	0
79	TRUMP	We have every record.	0
80	TRUMP	But we’re getting close to that point again where we’ll create new records.	0
81	TRUMP	So our country is doing very well, economically.	0
82	TRUMP	And we’ve done a lot.	0
83	TRUMP	But one of the things I said I have to do and I want to do is border security, because we have tremendous amounts of drugs flowing into our country, much of it coming from the southern border.	0
84	TRUMP	When you look and when you listen to politicians — in particular, certain Democrats — they say it all comes through the port of entry.	1
85	TRUMP	It’s wrong.	0
86	TRUMP	It’s wrong.	0
87	TRUMP	It’s just a lie.	0
88	TRUMP	It’s all a lie.	0
89	TRUMP	They say walls don’t work.	0
90	TRUMP	Walls work 100 percent.	1
91	TRUMP	Whether it’s El Paso — I really was smiling, because the other night I was in El Paso — we had a tremendous crowd, and — tremendous crowd.	0
92	TRUMP	And I asked the people — many of whom were from El Paso, but they came from all over Texas.	0
93	TRUMP	And I asked them.	0
94	TRUMP	"I said, ""Let me ask you, as a crowd: When the wall went up, was it better?"""	0
95	TRUMP	You were there, some of you.	0
96	TRUMP	"It was not only better; it was like 100 percent better."	1
97	TRUMP	You know what they did.	0
98	TRUMP	But that’s only one example.	0
99	TRUMP	There are so many examples.	0
100	TRUMP	In El Paso, they have close to 2,000 murders right on the other side of the wall.	1
101	TRUMP	And they had 23 murders.	0
102	TRUMP	It’s a lot of murders, but it’s not close to 2,000 murders right on the other side of the wall, in Mexico.	1
103	TRUMP	So everyone knows that walls work.	1
104	TRUMP	And there are better examples than El Paso, frankly.	0
105	TRUMP	You just take a look.	0
106	TRUMP	Almost everywhere.	0
107	TRUMP	Take a look at Israel.	0
108	TRUMP	They’re building another wall.	0
109	TRUMP	Their wall is 99.9 percent effective, they told me — 99.9 percent.	0
110	TRUMP	That’s what it would be with us, too.	0
111	TRUMP	The only weakness is they go to a wall and then they go around the wall.	0
112	TRUMP	They go around the wall and in.	0
113	TRUMP	Okay?	0
114	TRUMP	That’s what it is.	0
115	TRUMP	It’s very simple.	0
116	TRUMP	And a big majority of the big drugs — the big drug loads — don’t go through ports of entry.	0
117	TRUMP	They can’t go through ports of entry.	0
118	TRUMP	"You can’t take big loads because you have people — we have some very capable people; the Border Patrol, law enforcement — looking."	0
119	TRUMP	You can’t take human traffic — women and girls — you can’t take them through ports of entry.	0
120	TRUMP	You can’t have them tied up in the backseat of a car or a truck or a van.	0
121	TRUMP	They open the door.	0
122	TRUMP	They look.	0
123	TRUMP	They can’t see three women with tape on their mouth or three women whose hands are tied.	0
124	TRUMP	They go through areas where you have no wall.	0
125	TRUMP	Everybody knows that.	0
126	TRUMP	Nancy knows it.	0
127	TRUMP	Chuck knows it.	0
128	TRUMP	They all know it.	0
129	TRUMP	It’s all a big lie.	0
130	TRUMP	It’s a big con game.	0
131	TRUMP	You don’t have to be very smart to know: You put up a barrier, the people come in, and that’s it.	0
132	TRUMP	They can’t do anything unless they walk left or right, and they find an area where there’s no barrier, and they come into the United States.	0
133	TRUMP	Welcome.	0
134	TRUMP	We’ve detained more people.	0
135	TRUMP	Our border agents are doing such incredible work.	0
136	TRUMP	Our military has been incredible.	0
137	TRUMP	We put up barbed wire on top of certain old walls that were there.	0
138	TRUMP	We fixed the wall and we loaded it up with barbed wire.	0
139	TRUMP	It’s very successful.	0
140	TRUMP	But our military has been fantastic, and I want to thank them.	0
141	TRUMP	And it’s very necessary.	0
142	TRUMP	We’ve broken up two caravans that are on their way.	0
143	TRUMP	They just are breaking.	0
144	TRUMP	They’re in the process of breaking up.	0
145	TRUMP	We have another one that we haven’t been able to break up yet.	0
146	TRUMP	We’ve been actually working with Mexico much better than ever before.	0
147	TRUMP	I want to thank the President.	0
148	TRUMP	I want to thank Mexico.	0
149	TRUMP	They have their own problems.	0
150	TRUMP	They have the largest number of murders that they’ve ever had in their history — almost 40,000 murders.	0
151	TRUMP	Forty thousand.	0
152	TRUMP	And they got to straighten that out, and I think they will.	0
153	TRUMP	But I just want to thank the President, because he’s been helping us with these monstrous caravans that have been coming up.	0
154	TRUMP	We had one that it was up to over 15,000 people.	0
155	TRUMP	It’s largely broken up.	0
156	TRUMP	Others have gotten through.	0
157	TRUMP	And, in Tijuana, you have a lot of people staying there.	0
158	TRUMP	"If we didn’t have the wall up, and if we didn’t have the wall secured and strengthened, they would have walked right through; they’d be welcomed to the United States."	0
159	TRUMP	One of the things we’d save tremendous — just a tremendous amount on would be sending the military.	0
160	TRUMP	If we had a wall, we don’t need the military because we’d have a wall.	0
161	TRUMP	So I’m going to be signing a national emergency.	0
162	TRUMP	And it’s been signed many times before.	0
163	TRUMP	It’s been signed by other Presidents from 1977 or so.	0
164	TRUMP	It gave the Presidents the power.	0
165	TRUMP	There’s rarely been a problem.	0
166	TRUMP	"They sign it; nobody cares."	0
167	TRUMP	I guess they weren’t very exciting.	0
168	TRUMP	But nobody cares.	0
169	TRUMP	They sign it for far less important things, in some cases, in many cases.	0
170	TRUMP	We’re talking about an invasion of our country with drugs, with human traffickers, with all types of criminals and gangs.	1
171	TRUMP	We have some of the greatest people I know.	0
172	TRUMP	They’ve been with me from the beginning of my campaign — almost from the first week.	0
173	TRUMP	The Angel Moms.	0
174	TRUMP	Unfortunately, we have new Angel Moms.	0
175	TRUMP	One incredible woman just showed me her daughter who — we’re talking about killed, in the year of ’18.	0
176	TRUMP	"I said, ""I haven’t seen you before."""	0
177	TRUMP	"She said, ""No, I’m new."""	0
178	TRUMP	"I said, ""That’s too bad."""	0
179	TRUMP	It’s too bad.	0
180	TRUMP	It’s so sad.	0
181	TRUMP	Stand up, just for a second.	0
182	TRUMP	Show how beautiful your girl was.	0
183	TRUMP	Thank you.	0
184	TRUMP	I have such respect for these people.	0
185	TRUMP	Angel Moms, Angel Dads, Angel Families.	0
186	TRUMP	I have great respect for these people.	0
187	TRUMP	These are great people.	0
188	TRUMP	These are great people.	0
189	TRUMP	They’re fighting for their children that have been killed by people that were illegally in this country.	0
190	TRUMP	"And the press doesn’t cover them; they don’t want to, incredibly."	0
191	TRUMP	And they’re not treated the way they should be.	0
192	TRUMP	They’re fighting for other people because they don’t want what happened to their children or husband or anybody.	0
193	TRUMP	We have one young lady whose husband — please, stand up.	0
194	TRUMP	Your husband was just killed in Maryland.	0
195	TRUMP	Incredible man.	0
196	TRUMP	Just killed.	0
197	TRUMP	Beautiful children — won’t be seeing their father again.	0
198	TRUMP	These are brave people.	0
199	TRUMP	These are people that — they don’t have to be here.	0
200	TRUMP	They don’t have to be doing this.	0
201	TRUMP	They’re doing it for other people.	0
202	TRUMP	So I just want to thank all of you for being here, okay?	0
203	TRUMP	I really do.	0
204	TRUMP	I want to thank you.	0
205	TRUMP	Incredible people.	0
206	TRUMP	Last year, 70,000 Americans were killed, at least — I think the number is ridiculously low — by drugs, including meth and heroin and cocaine, fentanyl.	0
207	TRUMP	And one of the things that I did with President Xi in China, when I met him in Argentina at a summit — before I even started talking about the trade — it was a trade meeting.	0
208	TRUMP	It went very well, but before I talked about trade, I talked about something more important.	0
209	TRUMP	"I said, ""Listen, we have tremendous amounts of fentanyl coming into our country. It kills tens of thousands of people — I think far more than anybody registers. And I’d love you to declare it a lethal drug and put it on your criminal list."""	0
210	TRUMP	And their criminal list is much tougher than our criminal list.	0
211	TRUMP	Their criminal list — a drug dealer gets a thing called the death penalty.	0
212	TRUMP	"Our criminal list, a drug dealer gets a thing called, ""How about a fine?"""	0
213	TRUMP	"And when I asked President Xi, I said, ""Do you have a drug problem?"""	0
214	TRUMP	"No, no, no. I said, ""You have 1.4 billion people. What do you mean you have no drug problem?"""	0
215	TRUMP	"No, we don’t have a drug problem.  I said, ""Why?"" ""Death penalty. We give death penalty to people that sell drugs."""	0
216	TRUMP	End of problem.	0
217	TRUMP	What do we do?	0
218	TRUMP	We set up blue ribbon committees.	0
219	TRUMP	Lovely men and women — they sit around a table, they have lunch, they eat, they dine, and they waste a lot of time.	0
220	TRUMP	So if we want to get smart, we can get smart.	0
221	TRUMP	You can end the drug problem.	0
222	TRUMP	You can end it a lot faster than you think.	0
223	TRUMP	But President Xi has agreed to put fentanyl on his list of deadly, deadly drugs.	0
224	TRUMP	And it’s a criminal penalty.	0
225	TRUMP	And the penalty is death.	0
226	TRUMP	So that’s, frankly, one of the things I’m most excited about in our trade deal, if you want to know the truth.	0
227	TRUMP	I think maybe there’s no more important point.	0
228	TRUMP	We’re going to make billions of dollars with this trade deal.	0
229	TRUMP	It’s going to be great for our country and great for China, I hope.	0
230	TRUMP	Their market is down close to 40 percent.	0
231	TRUMP	Our market is way up.	0
232	TRUMP	We’ve picked up, since my election, trillions of dollars of worth.	0
233	TRUMP	Trillions.	0
234	TRUMP	Many trillions.	0
235	TRUMP	And China has lost trillions of dollars.	0
236	TRUMP	But I want it to be good for China and I want it to be good for the United States.	0
237	TRUMP	So we’ll see what happens.	0
238	TRUMP	China is coming here next week, by the way.	0
239	TRUMP	They’re coming home, the traders.	0
240	TRUMP	And then China is coming here next week.	0
241	TRUMP	And then I’ll be meeting with President Xi at some point after that to maybe — for some remaining deals.	0
242	TRUMP	We’ll make them directly, one-on-one, ourselves.	0
243	TRUMP	So, we’re going to be signing today, and registering, national emergency.	0
244	TRUMP	And it’s a great thing to do because we have an invasion of drugs, invasion of gangs, invasion of people, and it’s unacceptable.	1
245	TRUMP	And by signing the national emergency — something signed many times by other Presidents — many, many times.	0
246	TRUMP	President Obama — in fact, we may be using one of the national emergencies that he signed, having to do with cartels.	0
247	TRUMP	Criminal cartels.	0
248	TRUMP	It’s a very good emergency that he signed.	0
249	TRUMP	And we’re going to use parts of it in our dealings on cartels.	0
250	TRUMP	So that would be a second national emergency.	0
251	TRUMP	But, in that case, it’s already in place.	0
252	TRUMP	And what we want — really want to do — is simple.	0
253	TRUMP	It’s not like it’s complicated.	0
254	TRUMP	It’s very simple: We want to stop drugs from coming into our country.	0
255	TRUMP	We want to stop criminals and gangs from coming into our country.	0
256	TRUMP	Nobody has done the job that we’ve ever done.	0
257	TRUMP	I mean, nobody has done the job that we’ve done on the border.	0
258	TRUMP	And in a way, what I did by creating such a great economy — and if the opposing party got in, this economy would be down the tubes.	0
259	TRUMP	"You know, I hear a lot of people say, ""Oh, well. But maybe the previous administration…"""	0
260	TRUMP	Let me tell you, the previous administration, it was heading south, and it was going fast.	0
261	TRUMP	We would have been down the tubes.	0
262	TRUMP	The regulations were strangling our country.	0
263	TRUMP	Unnecessary regulations.	0
264	TRUMP	"By creating such a strong economy — you just look at your televisions or see what’s going on today; it’s through the roof."	0
265	TRUMP	What happens is more people want to come, so we have far more people trying to get into our country today than probably we’ve ever had before.	1
266	TRUMP	And we’ve done an incredible job in stopping them, but it’s a massive number of people.	0
267	TRUMP	If we had the wall, it would be very easy.	0
268	TRUMP	We would make up for the cost of the wall just in the cost of the fact that I would be able to have fewer people.	0
269	TRUMP	We wouldn’t need all of this incredible talent, some of whom are sitting in the first row.	0
270	TRUMP	You wouldn’t need all of this incredible talent.	0
271	TRUMP	We would get — we would get thousands of law enforcement people, including Border Patrol.	0
272	TRUMP	You put them in different areas, you have them doing different things.	0
273	TRUMP	Law enforcement and Border Patrol.	0
274	TRUMP	And I want to thank law enforcement, and I want to thank Border Patrol, and I want to thank ICE.	0
275	TRUMP	ICE is abused by the press and by the Democrats.	0
276	TRUMP	And, by the way, we’re going to be taking care of ICE.	0
277	TRUMP	You know, we talk about the new bill.	0
278	TRUMP	We’re going to be taking care of ICE.	0
279	TRUMP	They wanted to get rid of ICE.	0
280	TRUMP	And the bill is just the opposite of that.	0
281	TRUMP	A lot of good things happened.	0
282	TRUMP	So, that’s the story.	0
283	TRUMP	We want to have a safe country.	0
284	TRUMP	"I ran on a very simple slogan: ""Make America Great Again."""	0
285	TRUMP	If you’re going to have drugs pouring across the border, if you’re going to have human traffickers pouring across the border in areas where we have no protection, in areas where we don’t have a barrier, then very hard to make America great again.	1
286	TRUMP	But we’ve done a fantastic job, but we haven’t been given the equipment.	0
287	TRUMP	We haven’t been given the walls.	0
288	TRUMP	And in the bill, by the way, they didn’t even fight us on most of the stuff.	0
289	TRUMP	Ports of entry.	0
290	TRUMP	We have so much money, we don’t know what to do with it.	0
291	TRUMP	I don’t know what to do with all the money they’re giving us.	0
292	TRUMP	It’s crazy.	0
293	TRUMP	The only place they don’t want to give as much money — $1,375,000,000.	0
294	TRUMP	Sounds like a lot, but it’s not so much, although we’re putting it to much better use than it used to be.	0
295	TRUMP	A lot of the past administrations, they had — it was easy to get, and they didn’t build or they didn’t do what they could have done.	0
296	TRUMP	It would have been great.	0
297	TRUMP	It would have been great to have done it earlier, but I was a little new to the job, a little new to the profession.	0
298	TRUMP	And we had a little disappointment for the first year and a half.	0
299	TRUMP	People that should have stepped up did not step up.	0
300	TRUMP	They didn’t step up, and they should have.	0
301	TRUMP	Would have been easy.	0
302	TRUMP	Not that easy, but it would have been a lot easier.	0
303	TRUMP	But some people didn’t step up.	0
304	TRUMP	But we’re stepping up now.	0
305	TRUMP	So we have a chance of getting close to $8 billion.	0
306	TRUMP	Whether it’s $8 billion or $2 billion or $1.5 billion, it’s going to build a lot of wall.	0
307	TRUMP	We’re getting it done.	0
308	TRUMP	We’re right now in construction with wall in some of the most important areas.	0
309	TRUMP	And we have renovated a tremendous amount of wall, making it just as good as new.	0
310	TRUMP	That’s where a lot of the money has been spent — on renovation.	0
311	TRUMP	In fact, we were restricted to renovating, which is okay.	0
312	TRUMP	But we’re going to run out of areas that we can renovate pretty soon.	0
313	TRUMP	So — and we need new wall.	0
314	TRUMP	So I want to thank everybody for being here.	0
315	TRUMP	I want to thank, in particular, the Angel Moms and Dads for being here.	0
316	TRUMP	Thank you very much.	0
317	TRUMP	We have great respect for you.	0
318	TRUMP	The real country, our real country — the people that really love our country, they love you.	0
319	TRUMP	So I just want you to know that.	0
320	TRUMP	I know how hard you fight and I know how hard a fight you’re having.	0
321	TRUMP	I also want to thank all of the law enforcement for the job you do.	0
322	TRUMP	Believe me, our country loves you and they respect you greatly.	0
323	TRUMP	And we’re giving you a lot of surplus.	0
324	TRUMP	We’re giving you surplus military equipment, which a lot of people didn’t like giving, previous to this administration.	0
325	TRUMP	But hundreds of millions of dollars of surplus equipment.	0
326	TRUMP	And as we get it, as you know, we send it down.	0
327	TRUMP	And you have much better protection.	0
328	TRUMP	But I really appreciate you being here.	0
329	TRUMP	So the order is signed.	0
330	TRUMP	And I’ll sign the final papers as soon as I get into the Oval Office.	0
331	TRUMP	And we will have a national emergency, and then we will then be sued, and they will sue us in the Ninth Circuit, even though it shouldn’t be there.	0
332	TRUMP	And we will possibly get a bad ruling, and then we’ll get another bad ruling.	0
333	TRUMP	And then we’ll end up in the Supreme Court, and hopefully we’ll get a fair shake.	0
334	TRUMP	And we’ll win in the Supreme Court, just like the ban.	0
335	TRUMP	They sued us in the Ninth Circuit, and we lost, and then we lost in the appellate division, and then we went to the Supreme Court, and we won.	0
336	TRUMP	And it was very interesting, because yesterday they were talking about the ban.	0
337	TRUMP	Because we have a ban.	0
338	TRUMP	It’s very helpful.	0
339	TRUMP	Madam Secretary, is that right?	0
340	TRUMP	Without the ban, we’d have a bigger problem.	0
341	TRUMP	We have a ban on certain areas, certain countries, depending on what’s going on in the world.	0
342	TRUMP	And we won.	0
343	TRUMP	"But somebody said, ""President Trump lost on the ban."""	0
344	TRUMP	"Well, he was right; I lost at the lower court."	0
345	TRUMP	He — he didn’t say that we ultimately won at the United States Supreme Court.	0
346	TRUMP	They didn’t want to say that.	0
347	TRUMP	They didn’t want to go that far.	0
348	TRUMP	They were saying how I lost.	0
349	TRUMP	"The person sitting right up here — ""Donald Trump lost on the ban."""	0
350	TRUMP	Yeah, I did.	0
351	TRUMP	"And then I lost a second time; you should have said that, too."	0
352	TRUMP	And then it went to the Supreme Court and I won.	0
353	TRUMP	Didn’t want to take it that far.	0
354	TRUMP	But we won on the ban and we won on other things, too.	0
355	TRUMP	The probably easiest one to win is on declaring a national emergency, because we’re declaring it for virtual invasion purposes: drugs, traffickers, and gangs.	0
356	TRUMP	And one of the things, just to finish: We have removed thousands of MS-13 gang monsters.	0
357	TRUMP	Thousands.	0
358	TRUMP	They’re out of this country.	0
359	TRUMP	We take them out by the thousands.	0
360	TRUMP	And they are monsters.	0
361	TRUMP	Okay.	0
362	TRUMP	Do you have any questions?	0
363	TRUMP	Yeah.	0
364	TRUMP	John, go ahead.	0
365	QUESTION	Mr. President — (inaudible).	0
366	QUESTION	AIDE:  Yes, we do.	0
367	QUESTION	There you go.	0
368	QUESTION	You were prepared.	0
369	QUESTION	Mr. President, a lot of the money —	0
370	TRUMP	Were you saying I was prepared?	0
371	QUESTION	With the microphone and prepared for questions.	0
372	TRUMP	Oh, I thought you meant I was prepared.	0
373	TRUMP	I couldn’t believe you said that.	0
374	QUESTION	(LAUGHTER)	0
375	QUESTION	No, no, no.	0
