759	TRUMP	But I talk about it because I consider it very important.	0
760	TRUMP	But first, I have to straighten out the military.	0
761	TRUMP	The military was depleted.	0
762	TRUMP	"And if we don’t have a strong military — that hopefully we won’t have to use because it’s strong — if we don’t have a strong military, you don’t have to worry about debt; you have bigger problems."	0
763	TRUMP	So I have to straighten out the military.	0
764	TRUMP	That’s why I did the $700- and $716 billion.	0
765	TRUMP	But growth will straighten it out.	0
766	TRUMP	You saw last month, the trade deficit went way down.	1
767	TRUMP	"Everybody said, ""What happened?""  Well, what’s happening is growth."	0
768	TRUMP	But before I can focus too much on that, a very big expense is military.	0
769	TRUMP	And we have no choice but to straighten out our military.	0
770	QUESTION	Is growth the only answer, sir, or is (inaudible)?	0
771	TRUMP	Yes, ma’am, go ahead.	0
772	QUESTION	Thank you, Mr. President.	0
773	QUESTION	On North Korea — back on the last summit, you guys came out with a pretty general agreement.	0
774	TRUMP	Yes.	0
775	QUESTION	I was wondering what you thought has, you know, been accomplished since the last summit.	0
776	QUESTION	And then —	0
777	TRUMP	A lot.	0
778	QUESTION	— are we going to be seeing anything concrete —	0
779	TRUMP	A lot has been accomplished.	0
780	TRUMP	Okay.	0
781	QUESTION	— on denuclearization.	0
782	TRUMP	Yeah.	0
783	TRUMP	A lot has been accomplished.	0
784	TRUMP	We’re dealing with them, we’re talking to them.	0
785	TRUMP	When I came into office, I met right there, in the Oval Office, with President Obama.	0
786	TRUMP	And I sat in those beautiful chairs and we talked.	0
787	TRUMP	It was supposed to be 15 minutes.	0
788	TRUMP	As you know, it ended up being many times longer than that.	0
789	TRUMP	"And I said, ""What’s the biggest problem?"""	0
790	TRUMP	"He said, ""By far, North Korea."""	0
791	TRUMP	And I don’t want to speak for him, but I believe he would have gone to war with North Korea.	0
792	TRUMP	I think he was ready to go to war.	0
793	TRUMP	In fact, he told me he was so close to starting a big war with North Korea.	0
794	TRUMP	And where are we now?	0
795	TRUMP	No missiles.	0
796	TRUMP	No rockets.	0
797	TRUMP	No nuclear testing.	0
798	TRUMP	We’ve learned a lot.	0
799	TRUMP	But much more importantly than all of it — much more important — much, much more important that that is we have a great relationship.	0
800	TRUMP	I have a very good relationship with Kim Jong Un.	0
801	TRUMP	And I’ve done a job.	0
802	TRUMP	In fact, I think I can say this: Prime Minister Abe of Japan gave me the most beautiful copy of a letter that he sent to the people who give out a thing called the Nobel Prize.	0
803	TRUMP	"He said, ""I have nominated you…"" or ""Respectfully, on behalf of Japan, I am asking them to give you the Nobel Peace Prize."""	0
804	TRUMP	"I said, ""Thank you."""	0
805	TRUMP	Many other people feel that way too.	0
806	TRUMP	I’ll probably never get it, but that’s okay.	0
807	TRUMP	They gave it to Obama.	0
808	TRUMP	He didn’t even know what he got it for.	0
809	TRUMP	He was there for about 15 seconds and he got the Nobel Prize.	0
810	TRUMP	"He said, ""Oh, what did I get it for?"""	0
811	TRUMP	With me, I probably will never get it.	0
812	TRUMP	But if you look at Idlib Province in Syria, I stopped the slaughter of perhaps 3 million people.	0
813	TRUMP	Nobody talk about that.	0
814	TRUMP	They don’t talk about that.	0
815	TRUMP	Russia and Iran and Syria were going to go in and perhaps destroy 3 million people in order to get 45,000 terrorists.	0
816	TRUMP	"And I heard about it from a woman who had her parents and her brothers living there, and she said, ""Please, please."""	0
817	TRUMP	"And I thought — I said, ""No, it can’t happen. What are you talking about?"""	0
818	TRUMP	No, they’re going to get…	0
819	TRUMP	And I come home, and I read a certain paper where the story was there that they were actually forming to go into — to really — to really do big destruction.	0
820	TRUMP	"And I put out a statement that ""you better not do it."""	0
821	TRUMP	And in all fairness to Russia and Iran and Syria, they didn’t attack.	0
822	TRUMP	Or they’re doing it surgically, at least.	0
823	TRUMP	Saved a lot of people.	0
824	TRUMP	We do a lot of good work.	0
825	TRUMP	This administration does a tremendous job, and we don’t get credit for it.	0
826	TRUMP	But I think the people understand what we do.	0
827	TRUMP	So Prime Minister Abe gave me — I mean, it’s the most beautiful five letter — five-page letter.	0
828	TRUMP	Nobel Prize.	0
829	TRUMP	He sent it to them.	0
830	TRUMP	You know why?	0
831	TRUMP	Because he had rocket ships and he had missiles flying over Japan.	0
832	TRUMP	"And they had alarms going off; you know that."	0
833	TRUMP	"Now, all of a sudden, they feel good; they feel safe."	0
834	TRUMP	I did that.	0
835	TRUMP	And it was a very tough dialogue at the beginning.	0
836	TRUMP	Fire and fury.	0
837	TRUMP	Total annihilation.	0
838	TRUMP	"My button is bigger than yours and ""my button works."""	0
839	TRUMP	Remember that?	0
840	TRUMP	You don’t remember that.	0
841	TRUMP	"And people said, ""Trump is crazy."""	0
842	TRUMP	And you know what it ended up being?	0
843	TRUMP	A very good relationship.	0
844	TRUMP	I like him a lot and he likes me a lot.	0
845	TRUMP	Nobody else would have done that.	0
846	TRUMP	The Obama administration couldn’t have done it.	0
847	TRUMP	Number one, they probably wouldn’t have done it.	0
848	TRUMP	And number two, they didn’t have the capability to do it.	0
849	TRUMP	So I just want to thank everybody.	0
850	TRUMP	I want to wish our Attorney General great luck and speed, and enjoy your life.	0
851	SYSTEM	(LAUGHTER)	0
852	TRUMP	Bill, good luck.	0
853	TRUMP	A tremendous reputation.	0
854	TRUMP	I know you’ll do a great job.	0
855	TRUMP	Thank you very much.	0
856	TRUMP	And thank you, everybody.	0
857	TRUMP	Thank you very much.	0
858	TRUMP	Thank you.	0