376	QUESTION	(LAUGHTER)	0
377	TRUMP	People don’t like saying that.	0
378	QUESTION	You were prepared for questions.	0
379	TRUMP	I am prepared.	0
380	TRUMP	I’m always prepared.	0
381	QUESTION	A lot of the money that goes to count toward your $8 billion is money that’s being reprogrammed in the DOD budget.	0
382	QUESTION	How can you guarantee to military families and to our men and women of the military that none of the money that would be reprogrammed to a wall will take away from other technology, other renovations, construction that is desperately needed in our military?	0
383	TRUMP	Yeah.	0
384	TRUMP	So, John, we had certain funds that are being used at the discretion of generals, at the discretion of the military.	0
385	TRUMP	Some of them haven’t been allocated yet, and some of the generals think that this is more important.	0
386	TRUMP	I was speaking to a couple of them.	0
387	TRUMP	They think this is far more important than what they were going to use it for.	0
388	TRUMP	"I said, ""What were you going to use it for?"""	0
389	TRUMP	And I won’t go into details, but it didn’t sound too important to me.	0
390	TRUMP	Plus, if you think, I’ve gotten $700 billion for the military in year one, and then last year, $716 billion.	0
391	TRUMP	And we’re rebuilding our military, but we have a lot.	0
392	TRUMP	And under the previous administration, our military was depleted — badly depleted.	0
393	TRUMP	And they weren’t spending — I mean, they had a much less — they had a much smaller amount of money.	0
394	TRUMP	So when I got $700 billion, and then $716 billion — and this year, it’s going to be pretty big too, because there’s few things more important than our military.	0
395	TRUMP	You know, I’m a big deficit believer and all of that, but before we really start focusing on certain things, we have to build up our military.	0
396	TRUMP	It was very badly depleted.	0
397	TRUMP	And we’re buying all new jetfighters, all new missiles, all new defensive equipment.	0
398	TRUMP	We have — we’ll soon have a military like we’ve never had before.	0
399	TRUMP	But when you think about the kind of numbers you’re talking about — so you have $700 billion, $716 billion — when I need $2 billion, $3 billion of out that for a wall — which is a very important instrument, very important for the military because of the drugs that pour in.	0
400	TRUMP	And as you know, we have specific rules and regulations where they have drugs, and what you can do in order to stop drugs.	0
401	TRUMP	And that’s part of it, too.	0
402	TRUMP	We’re taking a lot of money from that realm also.	0
403	TRUMP	But when you have that kind of money going into the military, this is a very, very small amount that we’re asking for.	0
404	TRUMP	Yeah, go ahead.	0
405	TRUMP	Go ahead.	0
406	TRUMP	ABC.	0
407	TRUMP	Not NBC.	0
408	TRUMP	I like ABC a little bit more — not much.	0
409	TRUMP	Come on, ABC.	0
410	TRUMP	Not much.	0
411	TRUMP	Pretty close.	0
412	QUESTION	Mr. President, what do you say to those, including some of your Republican allies, who say that you are violating the Constitution with this move and setting a bad precedent that will be abused by possibly Democratic Presidents in the future?	0
413	QUESTION	Marco Rubio has made this point.	0
414	TRUMP	Well, not too many people.	0
415	TRUMP	Yeah.	0
416	TRUMP	Not too many people have said that.	0
417	TRUMP	But the courts will determine that.	0
418	TRUMP	Look, I expect to be sued.	0
419	TRUMP	I shouldn’t be sued.	0
420	TRUMP	Very rarely do you get sued when you do national emergency.	0
421	TRUMP	"And then other people say, ""Oh, if you use it for this, now what are we using it for?"""	0
422	TRUMP	We got to get rid of drugs and gangs and people.	0
423	TRUMP	It’s an invasion.	1
424	TRUMP	We have an invasion of drugs and criminals coming into our country that we stop, but it’s very hard to stop.	1
425	TRUMP	With a wall, it would be very easy.	0
426	TRUMP	So I think that we will be very successful in court.	0
427	TRUMP	I think it’s clear.	0
428	TRUMP	And the people that say we create precedent — well, what do you have?	0
429	TRUMP	Fifty-six?	0
430	TRUMP	There are a lot of times — well, that’s creating precedent.	0
431	TRUMP	And many of those are far less important than having a border.	0
432	TRUMP	If you don’t have a border, you don’t have a country.	0
433	TRUMP	You know, we fight — before I got here — we fight all over the world to create borders for countries, but we don’t create a border for our own country.	0
434	TRUMP	So I think what will happen is, sadly, we’ll be sued, and sadly, it’ll go through a process.	0
435	TRUMP	And, happily, we’ll win — I think.	0
436	TRUMP	Go ahead.	0
437	TRUMP	Let’s go.	0
438	TRUMP	Let’s hear it, NBC.	0
439	TRUMP	Come on.	0
440	QUESTION	Thank you, Mr. President.	0
441	QUESTION	"I just want to say, in the past, when President Obama tried to use executive action as it related to immigration, you said, ""The whole concept of executive order, it’s not the way the country is supposed to be run."""	0
442	QUESTION	"You said, ""You’re supposed to go through Congress and make a deal."""	0
443	QUESTION	Will you concede that you were unable to make the deal that you had promised in the past, and that the deal you’re ending up with now from Congress is less than what you could have had before a 35-day shutdown?	0
444	TRUMP	No.	0
445	TRUMP	Look, I went through Congress.	0
446	TRUMP	I made a deal.	0
447	TRUMP	I got almost $1.4 billion when I wasn’t supposed to get one dollar — not one dollar.	0
448	TRUMP	He’s not going to get one dollar.	0
449	TRUMP	Well, I got $1.4 billion.	0
450	TRUMP	But I’m not happy with it.	0
451	TRUMP	I also got billions and billions of dollars for other things — port of entries, lots of different things.	0
452	TRUMP	The purchase of drug equipment.	0
453	TRUMP	More than we were even requesting.	0
454	TRUMP	In fact, the primary fight was on the wall.	0
455	TRUMP	Everything else, we have so much, as I said, I don’t know what to do with it we have so much money.	0
456	TRUMP	But on the wall, they skimped.	0
457	TRUMP	So I did — I was successful, in that sense, but I want to do it faster.	0
458	TRUMP	I could do the wall over a longer period of time.	0
459	TRUMP	I didn’t need to do this.	0
460	TRUMP	But I’d rather do it much faster.	0
461	TRUMP	And I don’t have to do it for the election.	0
462	TRUMP	I’ve already done a lot of wall, for the election — 2020.	1
463	TRUMP	And the only reason we’re up here talking about this is because of the election, because they want to try and win an election, which it looks like they’re not going to be able to do.	0
464	TRUMP	And this is one of the ways they think they can possibly win, is by obstruction and a lot of other nonsense.	0
465	TRUMP	And I think that I just want to get it done faster, that’s all.	0
466	TRUMP	Okay.	0
467	TRUMP	Yes, ma’am, go ahead.	0
468	QUESTION	Thank you, Mr. President.	0
469	TRUMP	Thank you.	0
470	QUESTION	Roberta Rampton from Reuters.	0
471	QUESTION	I wanted to ask about China.	0
472	QUESTION	Do you feel that enough progress has been made in the talks to head off the increase in tariffs scheduled for March 1?	0
473	TRUMP	Well, you know, you’re talking to the wrong person, because I happen to like tariffs, okay?	0
474	TRUMP	I mean, we’re taking in billions and billions of dollars in tariffs from China.	0
475	TRUMP	And our steel industry now, as an example, we tax dumped steel — much of it comes from China — at 25 percent.	0
476	TRUMP	Our steel industry is so vibrant now again, they’re building plants all over the United States.	0
477	TRUMP	It’s a beautiful thing.	0
478	TRUMP	And from a defensive standpoint, and from any standpoint, you need steel.	0
479	TRUMP	You know, you can do without certain industries.	0
480	TRUMP	Our country cannot do without steel.	0
481	TRUMP	So, I love tariffs, but I also love them to negotiate.	0
482	TRUMP	And right now, China is paying us billions of dollars a year in tariffs.	0
483	TRUMP	And I haven’t even started.	0
484	TRUMP	Now, here’s the thing: If we make a deal, they won’t have to pay.	0
485	TRUMP	You know, it’ll be a whole different story.	0
486	TRUMP	They won’t be paying that, but we’ll have a fair deal.	0
487	TRUMP	There won’t be intellectual property theft.	0
488	TRUMP	There won’t be so many other things that have gone on.	0
489	TRUMP	And no other President has done this.	0
490	TRUMP	No other — you know, we didn’t have a deal with China.	0
491	TRUMP	You had the WTO, one of the worst trade deals ever made — probably even worse than NAFTA, if that’s believable, which, you know, hard to believe, because I think NAFTA was just a disaster.	0
492	TRUMP	It was a total disaster for our country.	0
493	TRUMP	And now we made the USMCA, which is going to be a terrific — a great deal.	0
494	TRUMP	And, by the way, the USMCA, from Mexico — that’s United States, Mexico, Canada — that’s where the money is coming from, not directly but indirectly, for the wall.	1
495	TRUMP	And nobody wants to talk about that.	0
496	TRUMP	Because we’re saving billions and billions of dollars a year, if Congress approves that deal.	0
497	TRUMP	"Now, they might now want to approve a deal just because they’ll say — one of the things I’m thinking of doing — this has never been done before: No matter how good a deal I make with China, if they sell me Beijing for one dollar, if they give me 50 percent of their land and every ship that they’ve built over the last two years — which is a lot — and they give them to me free, the Democrats will say, ""What a lousy deal; that’s a terrible deal."""	0
498	TRUMP	Like, ZTE, I got a billion — more than a billion-dollar penalty in a short period of time.	0
499	TRUMP	"And the Democrats said, ""Oh, should’ve gotten more."""	0
500	TRUMP	"When I made that deal, I said, ""This is incredible."""	0
501	TRUMP	I just got — I got over a billion-dollar penalty, plus they had to change their board of directors.	0
502	TRUMP	They had to change their top management.	0
503	TRUMP	But they had to pay over a billion dollars.	0
504	TRUMP	"I said, ""What a deal."""	0
505	TRUMP	It took like a week.	0
506	TRUMP	And the Democrats didn’t even know there was a problem with ZTE.	0
507	TRUMP	I’m the one that find them.	0
508	TRUMP	I’m the one that settled it.	0
509	TRUMP	Over a billion dollars.	0
510	TRUMP	And President Xi called me and he said it would be important to him if they could get a deal.	0
511	TRUMP	And we made a deal — paid — like, in a short period of time.	0
512	TRUMP	"The Democrats went out and said, ""Oh, they should’ve done better."""	0
513	TRUMP	So what I’m thinking of doing is getting Chuck Schumer, getting Nancy Pelosi, having them bring two or three of their brilliant representatives.	0
514	TRUMP	And we’ll all go down together, and what we’ll do is we’ll negotiate.	0
515	TRUMP	I’ll put them in the room and let them speak up.	0
516	TRUMP	Because any deal I make with China, if it’s the great — it’s going to be better than any deal that anybody ever dreamt possible, or I’m not going to have a deal.	0
517	TRUMP	It’s a very simple.	0
518	TRUMP	"But any deal I make with China, Schumer is going to stand up and say, ""Oh, it should’ve been better. It should’ve been better."" "	0
519	TRUMP	And you know what?	0
520	TRUMP	That’s not acceptable to me.	0
521	TRUMP	So I’m thinking about doing something very different.	0
522	TRUMP	I don’t think it’s ever been — I just don’t want to be second-guessed.	0
523	TRUMP	"But that’s not even second-guess; that’s called politics."	0
524	TRUMP	Sadly, I’d probably do the same thing to them, okay?	0
525	TRUMP	But any deal I make toward the end, I’m going to bring Schumer — at least offer him — and Pelosi.	0
526	TRUMP	"I’m going to say, ""Please join me on the deal."""	0
527	TRUMP	And, by the way, I just see our new Attorney General is sitting in the front row.	0
528	TRUMP	Please stand up, Bill.	0
529	SYSTEM	(APPLAUSE)	0
530	TRUMP	Such an easy job he’s got.	0
531	TRUMP	He’s got the easiest job in government.	0
532	TRUMP	Thank you and congratulations.	0
533	TRUMP	That was a great vote yesterday.	0
534	TRUMP	Thank you very much.	0
535	QUESTION	Mr. President —	0
536	TRUMP	Yes, go ahead.	0
537	TRUMP	Go ahead.	0
538	QUESTION	In your remarks, sir, you said that you were too new to politics, earlier in your administration, when you would’ve preferred that this be done.	0
539	QUESTION	Is that an admission of how you might be changing on the job?	0
540	QUESTION	And —	0
541	TRUMP	Well, I’m learning.	0
542	TRUMP	I mean, I am learning.	0
543	TRUMP	"Don’t forget, it’s not like I’ve done this for — a senator came into my office and said, ""Sir, I’ve been running for office for 30 years. I’ve won seven out of seven. I did lose a couple when I was younger."""	0
544	TRUMP	"I said, ""Well, I’ve won one out of one. But, you know, I never did politics before. Now I do politics."""	0
545	TRUMP	I will tell you, I’m very disappointed at certain people, a particular one, for not having pushed this faster.	0
546	QUESTION	Are you referring to Speaker Ryan, sir?	0
547	TRUMP	But I’ve learned — who?	0
548	QUESTION	Speaker Ryan.	0
549	TRUMP	Let’s not talk about it.	0
550	QUESTION	Okay.	0
551	TRUMP	What difference does it make?	0
552	TRUMP	But they should have pushed it faster.	0
553	TRUMP	They should have pushed it harder.	0
554	TRUMP	And they didn’t.	0
555	TRUMP	They didn’t.	0
556	TRUMP	If they would have, it would have been a little bit better.	0
557	TRUMP	In the meantime, I’ve built a lot of wall.	0
558	TRUMP	I have a lot of money, and I’ve built a lot of wall.	0
559	TRUMP	But it would’ve been nice to have gotten done.	0
560	TRUMP	"And I would like to see major immigration reform, and maybe that’s something we can all work on, Bill, where we all get together and do major immigration reform — not just for a wall, for a barrier; for port of entry, for other things."	0
561	TRUMP	We have a real problem.	0
562	TRUMP	We have catch-and-release.	1
563	TRUMP	You catch a criminal and you have to release them.	1
564	TRUMP	We have so many other things.	0
565	TRUMP	You have chain migration, where a bad person comes in, brings 22 or 23 or 35 of his family members — because he has his mother, his grandmother, his sister, his cousin, his uncle — they’re all in.	0
566	TRUMP	You know what happened on the West Side Highway.	0
567	TRUMP	That young wise guy drove over and killed eight people and horribly injured — nobody talks about that — horribly — like, loss of legs and arms — going 60 miles an hour, he made a right turn into a park on the West Side Highway, along the Hudson River in New York.	0
568	TRUMP	He had many people brought in because he was in the United States.	1
569	TRUMP	It’s called chain migration.	1
570	TRUMP	And then you have the lottery.	0
571	TRUMP	"It’s a horror show, because when countries put people into the lottery, they’re not putting you in; they’re putting some very bad people in the lottery."	1
572	TRUMP	It’s common sense.	0
573	TRUMP	"If I ran a country, and if I have a lottery system of people going to the United States, I’m not going to put in my stars; I’m going to put in people I don’t want."	0
574	TRUMP	The lottery system is a disaster.	0
575	TRUMP	I’m stuck with it.	0
576	QUESTION	Mr. President, could you tell us —	0
577	TRUMP	It should have — wait.	0
578	TRUMP	It should have never happened.	0
579	TRUMP	Okay.	0
580	QUESTION	Mr. President, could you tell us to what degree some of the outside conservative voices helped to shape your views on this national emergency?	0
581	TRUMP	I would talk about it.	0
582	TRUMP	Look, Sean Hannity has been a terrific, terrific supporter of what I do.	0
583	TRUMP	Not of me.	0
584	TRUMP	If I changed my views, he wouldn’t be with me.	0
585	TRUMP	Rush Limbaugh — I think he’s a great guy.	0
586	TRUMP	Here’s a guy who can speak for three hours without a phone call.	0
587	TRUMP	Try doing that sometime.	0
588	TRUMP	For three hours, he speaks.	0
589	TRUMP	He’s got one of the biggest audiences in the history of the world.	0
590	TRUMP	I mean, this guy is unbelievable.	0
591	TRUMP	Try speaking for three hours without taking calls.	0
592	TRUMP	Taking calls is easy.	0
593	TRUMP	Okay, I’ll answer this one. I’ll answer that one.	0
594	TRUMP	He goes for three hours, and he’s got an audience that’s fantastic.	0
595	QUESTION	Should they be —	0
596	TRUMP	Wait —	0
597	QUESTION	Should they be deciding policy, sir?	0
598	TRUMP	They don’t decide policy.	0
599	TRUMP	In fact, if I went opposite — I mean, they have somebody — Ann Coulter.	0
600	TRUMP	I don’t know her.	0
601	TRUMP	I hardly know her.	0
602	TRUMP	I haven’t spoken to her in way over a year.	0
603	TRUMP	"But the press loves saying ""Ann Coulter."""	0
604	TRUMP	Probably, if I did speak to her, she’d be very nice.	0
605	TRUMP	I just don’t have the time to speak to her.	0
606	TRUMP	"I would speak to her; I have nothing against her."	0
607	TRUMP	"In fact, I like her for one reason: When they asked her, like right at the beginning, who was going to win the election, she said, ""Donald Trump."""	0
608	TRUMP	And the two people that asked her that question smiled.	0
609	TRUMP	"They said, ""You’re kidding, aren’t you?"""	0
610	TRUMP	Nope. Donald Trump.	0
611	TRUMP	So I like her, but she’s off the reservation.	0
612	TRUMP	But anybody that knows her understands that.	0
613	TRUMP	But I haven’t spoken to her.	0
614	TRUMP	I don’t follow her.	0
615	TRUMP	I don’t talk to her.	0
616	TRUMP	"But the press loves to bring up the name ""Ann Coulter."""	0
617	TRUMP	And you know what?	0
618	TRUMP	I think she’s fine.	0
619	TRUMP	I think she’s good.	0
620	TRUMP	But I just don’t speak to her.	0
621	TRUMP	Laura has been great.	0
622	TRUMP	Laura Ingraham.	0
623	TRUMP	Tucker Carlson has been great.	0
624	TRUMP	I actually have a couple people on CNN that have been very good.	0
625	TRUMP	I have some on MSNBC.	0
626	TRUMP	The other day, they did a great report of me.	0
627	TRUMP	"I said, ""Where the hell did that come from?"""	0
628	TRUMP	I think it was the only one in over a year.	0
629	TRUMP	So the crazy thing is, I just had, as you know, Rasmussen — 52 percent in the polls.	0
630	TRUMP	It’s my highest poll number.	0
631	TRUMP	And people get what we’re doing.	0
632	TRUMP	They get it.	0
633	TRUMP	They really get it.	0
634	TRUMP	And I’m honored by it.	0
635	TRUMP	Yes.	0
636	TRUMP	Jim Acosta.	0
637	QUESTION	Thank you, Mr. President.	0
638	QUESTION	"I wonder if you could comment on this disconnect that we seem to have in this country, where you are presenting information about what’s happening at the border — calling it an ""invasion,"" talking about women with duct tape over their mouths, and so on — and yet there’s a lot of reporting out there, there’s a lot of crime data out there, there’s a lot of Department of Homeland Security data out there that shows border crossings at a near-record low —"	0
639	TRUMP	That’s because of us.	0
640	TRUMP	But it’s still —	0
641	QUESTION	— that shows undocumented immigrants committing crime at lower levels —	0
642	TRUMP	Excuse me.	0
643	TRUMP	It’s still massive numbers of crossings.	0
644	QUESTION	— that shows undocumented criminals — or undocumented immigrants committing crime at lower levels than native-born Americans.	0
645	QUESTION	What do you say —	0
646	TRUMP	You don’t really believe that stat, do you?	0
647	TRUMP	Do you really believe that stat?	0
648	QUESTION	What do you — well, let me ask you this —	0
649	TRUMP	Take a look at our federal prisons.	0
650	QUESTION	I believe in facts and statistics and data, but —	0
651	TRUMP	Okay?	0
652	TRUMP	Any more?	0
653	TRUMP	Quick, let’s go.	0
654	QUESTION	Let me just ask you this: What do you say to your critics who say that you are creating a national emergency, that you’re concocting a national emergency here in order to get your wall because you couldn’t get it through other ways?	0
655	TRUMP	I ask the Angel Moms: What do you think?	0
656	TRUMP	Do you think I’m creating something?	0
657	TRUMP	Ask these incredible women, who lost their daughters and their sons.	0
658	TRUMP	Okay?	0
659	QUESTION	This is real.	0
660	TRUMP	Because your question is a very political question because you have an agenda.	0
661	TRUMP	You’re CNN.	0
662	TRUMP	You’re fake news.	0
663	TRUMP	You have an agenda.	0
664	TRUMP	The numbers that you gave are wrong.	0
665	TRUMP	Take a look at our federal prison population.	0
666	TRUMP	See how many of them, percentage-wise, are illegal aliens.	0
667	TRUMP	Just see.	0
668	TRUMP	Go ahead and see.	0
669	TRUMP	It’s a fake question.	0
670	TRUMP	Yes.	0
671	TRUMP	Go ahead.	0
672	QUESTION	Can I ask a follow-up?	0
673	QUESTION	Thank you, Mr. President.	0
674	QUESTION	Just to follow up on that, unifying crime reporting statistics — numbers from your own Border Patrol, numbers from this government — show that the amount of illegal immigrants are down, there is not violence on the border, and that most —	0
675	TRUMP	There’s not violence on the border?	0
676	QUESTION	There’s not as much violence as —	0
677	TRUMP	Oh, really?	0
678	QUESTION	Let me — wait a minute.	0
679	QUESTION	Wait a minute.	0
680	QUESTION	Wait —	0
681	TRUMP	You had 26 people killed —	0
682	QUESTION	Let me finish the question, please.	0
683	QUESTION	Let me finish the question, please.	0
684	TRUMP	Two weeks ago, 26 people were killed in a gunfight on the border —	0
685	QUESTION	I understand what you’re — I understand what you’re saying.	0
686	TRUMP	— a mile away from where I went.	0
687	QUESTION	I was there.	0
688	QUESTION	I understand.	0
689	QUESTION	That’s not the question.	0
690	QUESTION	The question is —	0
691	TRUMP	Do we forget about that?	0
692	QUESTION	No, I’m not forgetting about it.	0
693	QUESTION	I’m asking you to clarify where you get your numbers, because most of the DEA crime reporting statistics that we see show that drugs are coming across at the ports of entry, that illegal immigration is down, and the violence is down.	0
694	TRUMP	Okay.	0
695	QUESTION	So what do you base your facts on?	0
696	TRUMP	Okay, let me — come on, let’s go.	0
697	TRUMP	Sort of — sort of —	0
698	QUESTION	And, secondly —	0
699	TRUMP	No, no.	0
700	TRUMP	You get one.	0
701	TRUMP	You get one.	0
702	TRUMP	Ready?	0
703	QUESTION	Well, the second question is —	0
704	TRUMP	Just sit down.	0
705	TRUMP	Wait.	0
706	TRUMP	Sit down.	0
707	TRUMP	Sit down.	0
708	QUESTION	Could you please answer it?	0
709	TRUMP	Sit down.	0
710	TRUMP	You get one question.	0
711	TRUMP	I get my numbers from a lot of sources — like Homeland Security, primarily.	0
712	TRUMP	And the numbers that I have from Homeland Security are a disaster.	0
713	TRUMP	And you know what else is a disaster?	0
714	TRUMP	The numbers that come out of Homeland Security, Kirstjen, for the cost that we spend and the money that we lose because of illegal immigration: Billions and billions of dollars a month.	0
715	TRUMP	Billions and billions of dollars.	0
716	TRUMP	And it’s unnecessary.	0
717	QUESTION	So your own government stats are wrong, are you saying?	0
718	TRUMP	No, no.	0
719	TRUMP	I use many stats.	0
720	TRUMP	I use many stats.	0
721	QUESTION	Could you share those stats with us?	0
722	TRUMP	Let me tell you, you have stats that are far worse than the ones that I use.	0
723	TRUMP	But I use many stats, but I also use Homeland Security.	0
724	TRUMP	All right, next question.	0
725	QUESTION	And do you — wait a minute.	0
726	QUESTION	Just a quick follow-up.	0
727	TRUMP	Go ahead.	0
728	TRUMP	No.	0
729	TRUMP	Go.	0
730	TRUMP	Please.	0
731	QUESTION	Thank you, Mr. President.	0
732	QUESTION	I just want to bring you back to China for a second.	0
733	QUESTION	The White House put out a statement today talking about the March 1st deadline.	0
734	QUESTION	The other day, though, you gave the possibility that maybe this could slide.	0
735	QUESTION	Are you eyeing a possible extension — 30 days, maybe 60 days?	0
736	QUESTION	What is the status there?	0
737	QUESTION	Or is March 1st the deadline?	0
738	TRUMP	Yeah.	0
739	TRUMP	Very good question.	0
740	TRUMP	So it’s a very big deal.	0
741	TRUMP	I guess you could say it’s like — must be the biggest deal ever made, if you think.	0
742	TRUMP	Trade with China, how big does that get?	0
743	TRUMP	Although if you look, the USCMA is right up there.	0
744	TRUMP	But it’s very complicated.	0
745	TRUMP	There are many, many points that we’re bringing up that nobody ever brought up or thought to bring up, but they’re very important, because we were on the wrong side of every one of them.	0
746	TRUMP	There is a possibility that I will extend the date.	0
747	TRUMP	And if I do that, if I see that we’re close to a deal or the deal is going in the right direction, I would do that at the same tariffs that we’re charging now.	0
748	TRUMP	I would not increase the tariffs.	0
749	QUESTION	Let me also ask you about the debt, sir, because it’s gone from a shade under $20 trillion from when you took office.	0
750	QUESTION	Now it’s a shade over $22 trillion and heading in the wrong direction.	0
751	QUESTION	What are your plans to reverse it?	0
752	TRUMP	Well, it’s all about growth.	0
753	TRUMP	But before I —	0
754	QUESTION	(Inaudible.)	0
755	TRUMP	— really focus on that — and you have to remember, President Obama put on more debt on this country than every President in the history of our country combined.	0
756	TRUMP	So when I took over, we had one man that put on more debt than every other President combined.	0
757	TRUMP	Combine them all.	0
758	TRUMP	So you can’t be talking about that.	0
